### ISSUE TITLE
Internet routing not working, unable to ping DNS server or resolve hosts

### ISSUE THREAD

**Issue by vishiswoz** [kevoreilly/CAPEv2#2571]
My network setup is very similar to the one in this [issue](https://github.com/kevoreilly/CAPEv2/issues/1533). I set up a hostonly network and wish to enable a dirty line for internet routing. I followed the steps in the documentation but am unable to `ping 1.1.1.1` on my windows VM.

Network setup:
Windows VM: 192.168.55.214
Ubuntu 22.04 Host: 192.168.55.1

I followed the instructions to create an isolated hostonly network and the Windows VM has a static IP. I would like to forward the traffic from the VM to the Ubuntu host so it can reach out to the internet.

I get the following error whenever I try to ping a public DNS and I can't resolve any hosts:

<img width="511" alt="Image" src="https://github.com/user-attachments/assets/adbe27d1-a291-4528-a478-b4e56c5d0ff7" />

Running tcpdump on the virtual interface `virbr1`, which is the hostonly network with my Ubuntu 22.04 host and windows 10 VM shows this issue:

```
22:54:15.540983 IP 192.168.55.214 > 1.1.1.1: ICMP echo request, id 1, seq 12, length 40
22:54:15.541051 IP 192.168.55.1 > 192.168.55.214: ICMP 1.1.1.1 protocol 1 port 19791 unreachable, length 68
22:54:16.564119 IP 192.168.55.214 > 1.1.1.1: ICMP echo request, id 1, seq 13, length 40
22:54:16.564190 IP 192.168.55.1 > 192.168.55.214: ICMP 1.1.1.1 protocol 1 port 19790 unreachable, length 68
22:54:17.580025 IP 192.168.55.214 > 1.1.1.1: ICMP echo request, id 1, seq 14, length 40
22:54:17.580091 IP 192.168.55.1 > 192.168.55.214: ICMP 1.1.1.1 protocol 1 port 19789 unreachable, length 68
22:54:18.595385 IP 192.168.55.214 > 1.1.1.1: ICMP echo request, id 1, seq 15, length 40
```

The ping requests are being made, but my the Ubuntu host is just responding with a `port unreachable`. I'm not sure what the issue is. I have no firewalls of any sort enabled. The packets are also not being forwarded to the internet interface, because running `tcpdump` on that interface shows no ICMP packets.

Following is my `conf/routing.conf`

```
[routing]

# Enable pcap generation for non live connections?
# If you have huge number of VMs, pcap generation can be a bottleneck
enable_pcap = no

# Default network routing mode; "none", "internet", or "vpn_name".
# In none mode we don't do any special routing - the VM doesn't have any
# network access (this has been the default actually for quite a while).
# In internet mode by default all the VMs will be routed through the network
# interface configured below (the "dirty line").
# And in VPN mode by default the VMs will be routed through the VPN identified
# by the given name of the VPN.
# Note that just like enabling VPN configuration setting this option to
# anything other than "none" requires one to run utils/rooter.py as root next
# to the CAPE instance (as it's required for setting up the routing).
route = internet

# Network interface that allows a VM to connect to the entire internet, the
# "dirty line" so to say. Note that, just like with the VPNs, this will allow
# malicious traffic through your network. So think twice before enabling it.
# (For example, to route all VMs through eth0 by default: "internet = eth0").
internet = ens18

# When set to no masquerade rule has been not generated.
nat = yes

# When property nat set to yes. That property not used.
# When property nat set to no and no_local_routing to yes, a vrf configuration 
# will be generated and local traffic will go through by internet interface (dirty_line).
no_local_routing = yes

# Routing table name/id for "dirty line" interface. If "dirty line" is
# also default gateway in the system you can leave "main" value. Otherwise add
# new routing table by adding "<id> <name>" line to /etc/iproute2/rt_tables
# (e.g., "200 eth0"). ID and name must be unique across the system (refer to
# /etc/iproute2/rt_tables for existing names and IDs).
rt_table = main

# When using "dirty line", you can reject forwarding to a certain network segment.
# For example, a request targeting 192.168.12.1/24,172.16.22.1/24 will not be
# forwarded, but will be rejected:
# "reject_segments = 192.168.12.1/24,172.16.22.1/24"
reject_segments = none

# When ussing "dirty line", you can reject guest access a certain port.
# For example, a request targeting host's port 8000 and 8080 will be rejected:
# "reject_hostports = 8000,8080"
reject_hostports = none

# To route traffic through multiple network interfaces CAPE uses
# Policy Routing with separate routing table for each output interface
# (VPN or "dirty line"). If this option is enabled CAPE on start will try
# to automatically initialise routing tables by copying routing entries from
# main routing table to the new routing tables. Depending on your network/vpn
# configuration this might not be sufficient. In such case you would need to
# initialise routing tables manually. Note that enabling this option won't
# affect main routing table.
auto_rt = no

# The drop route basically drops any outgoing network (except for CAPE
# traffic) whereas the regular none route still allows a VM to access its own
# subnet (e.g., 192.168.122.1/24). It is disabled by default as it does require
# the optional rooter to run (unlike the none route, where literally nothing
# happens). One can either explicitly enable the drop route or if the rooter
# is enabled anyway, it is automatically enabled.
drop = no

# Should check if the inteface is up
verify_interface = yes

# Should check if rt_table exists before initializing
verify_rt_table = yes

[inetsim]
# Inetsim quick deploy, chose your vm manager if is not kvm
# wget https://googledrive.com/host/0B6fULLT_NpxMQ1Rrb1drdW42SkE/remnux-6.0-ova-public.ova
# tar xvf remnux-6.0-ova-public.ova
# qemu-img convert -O qcow2 REMnuxV6-disk1.vmdk remnux.qcow2

enabled = no
server = 192.168.1.2
dnsport = 53
interface = virbr1
# Redirect TCP ports (should we also support UDP?). If specified, this should
# represent whitespace-separated src:dst pairs. E.g., "80:8080 443:8080" will
# redirect all 80/443 traffic to 8080 on the specified InetSim host.
# Source port range redirection is also supported. E.g., "996-2041:80" will
# redirect all traffic directed at ports between 996 and 2041 inclusive to port 80
# on the specified InetSim host.
ports =


[tor]
enabled = no
dnsport = 5353
proxyport = 9040
interface = virbr1

[vpn]
# By default we disable VPN support as it requires running utils/rooter.py as
# root next to cuckoo.py (which should run as regular user).
enabled = no

# select one of the configured vpns randomly
random_vpn = no

# Comma-separated list of the available VPNs.
vpns = vpn0

[vpn0]
# Name of this VPN. The name is represented by the filepath to the
# configuration file, e.g., cuckoo would represent /etc/openvpn/cuckoo.conf
# Note that you can't assign the names "none" and "internet" as those would
# conflict with the routing section in cuckoo.conf.
name = vpn0

# The description of this VPN which will be displayed in the web interface.
# Can be used to for example describe the country where this VPN ends up.
description = openvpn_tunnel

# The tun device hardcoded for this VPN. Each VPN *must* be configured to use
# a hardcoded/persistent tun device by explicitly adding the line "dev tunX"
# to its configuration (e.g., /etc/openvpn/vpn1.conf) where X in tunX is a
# unique number between 0 and your lucky number of choice.
interface = tun0

# Routing table name/id for this VPN. If table name is used it *must* be
# added to /etc/iproute2/rt_tables as "<id> <name>" line (e.g., "201 tun0").
# ID and name must be unique across the system (refer /etc/iproute2/rt_tables
# for existing names and IDs).
rt_table = tun0


[socks5]
# By default we disable socks5 support as it requires running utils/rooter.py as
# root next to cuckoo.py (which should run as regular user).
enabled = no

# select one of the configured socks5 proxies randomly
random_socks5 = no

# Comma-separated list of the available proxies.
proxies = socks_ch

[socks_ch]
name = ch_socks
description = ch_socks
proxyport = 5008
dnsport = 10053
```

**Comment by doomedraven** [comment]
hello. can you start rooter by hand in verbose mode to verify that iptables? you need 
* `sudo systemctl stop cape-rooter` and then as cape user in poetry shell: `cd /opt/CAPEv2 && poetry run python utils/rooter.py -v` and start an analysis


also try to enable and you will need to restart `sudo systemctl restart cape`
```
# To route traffic through multiple network interfaces CAPE uses
# Policy Routing with separate routing table for each output interface
# (VPN or "dirty line"). If this option is enabled CAPE on start will try
# to automatically initialise routing tables by copying routing entries from
# main routing table to the new routing tables. Depending on your network/vpn
# configuration this might not be sufficient. In such case you would need to
# initialise routing tables manually. Note that enabling this option won't
# affect main routing table.
auto_rt = no
```

**Comment by doomedraven** [comment]
also did you configure netplan? https://capev2.readthedocs.io/en/latest/installation/host/routing.html#configuring-netplan

**Comment by vishiswoz** [comment]
I didn't configure a netplan, mostly because I couldn't tell from the documentation how to set it up for my needs as my network configuration is fairly simple. I have a hostonly network with the VM and wish to forward the data out through the internet line which is `ens18`. I figured setting the appropriate options in `conf/routing.conf` was enough based off of the previous issues. At least cape h as no issue enabling/disabling the internet route, I just can't get DNS to work and ping the public DNS from the guest.


```
2025-04-25 12:49:35,614 [cuckoo-rooter] INFO: Verbose logging enabled
2025-04-25 12:49:35,614 [cuckoo-rooter] DEBUG: Enabling IPv4 forwarding
2025-04-25 12:49:35,614 [cuckoo-rooter] DEBUG: Running command: /usr/sbin/sysctl -wnet.ipv4.ip_forward=1
2025-04-25 12:52:05,497 [cuckoo-rooter] INFO: Processing command: nic_available ens18 
2025-04-25 12:52:05,501 [cuckoo-rooter] INFO: Processing command: forward_enable dirty-line virbr1 0.0.0.0/0 192.168.55.214 
2025-04-25 12:52:05,501 [cuckoo-rooter] DEBUG: Running command: /sbin/iptables -D FORWARD -i dirty-line -j REJECT -m comment --comment CAPE-rooter
2025-04-25 12:52:05,503 [cuckoo-rooter] DEBUG: Running command: /sbin/iptables -D FORWARD -o dirty-line -j REJECT -m comment --comment CAPE-rooter
2025-04-25 12:52:05,505 [cuckoo-rooter] DEBUG: Running command: /sbin/iptables -I CAPE_ACCEPTED_SEGMENTS -i dirty-line -o virbr1 --source 0.0.0.0/0 --destination 192.168.55.214 -j ACCEPT -m comment --comment CAPE-rooter
2025-04-25 12:52:05,508 [cuckoo-rooter] INFO: Processing command: forward_enable dirty-line ens18 192.168.55.214 
2025-04-25 12:52:05,508 [cuckoo-rooter] DEBUG: Running command: /sbin/iptables -D FORWARD -i dirty-line -j REJECT -m comment --comment CAPE-rooter
2025-04-25 12:52:05,510 [cuckoo-rooter] DEBUG: Running command: /sbin/iptables -D FORWARD -o dirty-line -j REJECT -m comment --comment CAPE-rooter
2025-04-25 12:52:05,512 [cuckoo-rooter] DEBUG: Running command: /sbin/iptables -I CAPE_ACCEPTED_SEGMENTS -i dirty-line -o ens18 --source 192.168.55.214 -j ACCEPT -m comment --comment CAPE-rooter
2025-04-25 12:52:05,514 [cuckoo-rooter] INFO: Processing command: forward_enable dirty-line ens18 192.168.55.214 192.168.55.1 tcp 2042 
2025-04-25 12:52:05,515 [cuckoo-rooter] DEBUG: Running command: /sbin/iptables -D FORWARD -i dirty-line -j REJECT -m comment --comment CAPE-rooter
2025-04-25 12:52:05,516 [cuckoo-rooter] DEBUG: Running command: /sbin/iptables -D FORWARD -o dirty-line -j REJECT -m comment --comment CAPE-rooter
2025-04-25 12:52:05,518 [cuckoo-rooter] DEBUG: Running command: /sbin/iptables -I CAPE_ACCEPTED_SEGMENTS -i dirty-line -o ens18 --source 192.168.55.214 --destination 192.168.55.1 -p tcp -m multiport --dport 2042 -j ACCEPT -m comment --comment CAPE-rooter
2025-04-25 12:52:05,521 [cuckoo-rooter] INFO: Processing command: forward_enable dirty-line virbr1 192.168.55.1 192.168.55.214 
2025-04-25 12:52:05,521 [cuckoo-rooter] DEBUG: Running command: /sbin/iptables -D FORWARD -i dirty-line -j REJECT -m comment --comment CAPE-rooter
2025-04-25 12:52:05,523 [cuckoo-rooter] DEBUG: Running command: /sbin/iptables -D FORWARD -o dirty-line -j REJECT -m comment --comment CAPE-rooter
2025-04-25 12:52:05,524 [cuckoo-rooter] DEBUG: Running command: /sbin/iptables -I CAPE_ACCEPTED_SEGMENTS -i dirty-line -o virbr1 --source 192.168.55.1 --destination 192.168.55.214 -j ACCEPT -m comment --comment CAPE-rooter
2025-04-25 12:52:05,528 [cuckoo-rooter] INFO: Processing command: add_dev_to_vrf virbr1 
2025-04-25 12:52:05,528 [cuckoo-rooter] DEBUG: Running command: /sbin/ip link set dev virbr1 master dirty-line
2025-04-25 13:01:31,662 [cuckoo-rooter] INFO: Processing command: forward_disable dirty-line virbr1 0.0.0.0/0 192.168.55.214 
2025-04-25 13:01:31,662 [cuckoo-rooter] DEBUG: Running command: /sbin/iptables -D CAPE_ACCEPTED_SEGMENTS -i dirty-line -o virbr1 --source 0.0.0.0/0 --destination 192.168.55.214 -j ACCEPT -m comment --comment CAPE-rooter
2025-04-25 13:01:31,674 [cuckoo-rooter] INFO: Processing command: forward_disable dirty-line ens18 192.168.55.214 
2025-04-25 13:01:31,674 [cuckoo-rooter] DEBUG: Running command: /sbin/iptables -D CAPE_ACCEPTED_SEGMENTS -i dirty-line -o ens18 --source 192.168.55.214 -j ACCEPT -m comment --comment CAPE-rooter
2025-04-25 13:01:31,683 [cuckoo-rooter] INFO: Processing command: forward_disable dirty-line ens18 192.168.55.214 192.168.55.1 tcp 2042 
2025-04-25 13:01:31,683 [cuckoo-rooter] DEBUG: Running command: /sbin/iptables -D CAPE_ACCEPTED_SEGMENTS -i dirty-line -o ens18 --source 192.168.55.214 --destination 192.168.55.1 -p tcp -m multiport --dport 2042 -j ACCEPT -m comment --comment CAPE-rooter
2025-04-25 13:01:31,696 [cuckoo-rooter] INFO: Processing command: forward_disable dirty-line virbr1 192.168.55.1 192.168.55.214 
2025-04-25 13:01:31,696 [cuckoo-rooter] DEBUG: Running command: /sbin/iptables -D CAPE_ACCEPTED_SEGMENTS -i dirty-line -o virbr1 --source 192.168.55.1 --destination 192.168.55.214 -j ACCEPT -m comment --comment CAPE-rooter
2025-04-25 13:01:31,712 [cuckoo-rooter] INFO: Processing command: delete_dev_from_vrf virbr1 
2025-04-25 13:01:31,712 [cuckoo-rooter] DEBUG: Running command: /sbin/ip link set dev virbr1 nomaster
```

These are the logs from the rooter, so I can see the iptables being created.

The PCAP from the sample I executed simply shows a bunch of DNS requests being done from `192.168.55.214` to `1.1.1.1` with no response, so I do not think those requests are being forwarded to my `ens18` interface and NAT-ed.

![Image](https://github.com/user-attachments/assets/89c3c186-5ab6-40ba-83c1-43b0cd957dd6)

According to VirusTotal the sample does reach out to specific hosts. I also was unable to get any Behavior Analysis info from the sample itself, that tab is empty.

**Comment by doomedraven** [comment]
well to properly route traffic you need to configure netplan, just replace `enx00a0c6000000` with `ens18` and fix network ranges for your need thats all

**Comment by vishiswoz** [comment]
I'll try that and update if I still have issues.

**Comment by vishiswoz** [comment]
Do i need a management interface, ie a `enp8s0`? or can I just keep `ens18` only.

**Comment by doomedraven** [comment]
Ens18 should be fine

**Comment by ghost** [comment]
Hello @vishiswoz 
The problem lies within nftables, try to delete (but before that try to do exactly the same tests above, you find that the rejected packets are exactly what is given by the rules counter), rooter tries to do so through iptables but it is not enough
`libvirt_network guest_output`
`libvirt_network guest_input`

Additional rules should be added (I think rooter does not manage that stuff, `nat=yes` is not reflected)
`sudo nft add rule ip nat postrouting oifname "dirty_line_iface" masquerade`             
 `sudo nft insert rule ip filter CAPE_ACCEPTED_SEGMENTS iifname "dirty_line_iface" oifname "virbr1" counter accept`

**Comment by doomedraven** [comment]
that very interesting input, I never had problems with internet before, but I will try to test your input and update router if needed, but it will take some time

**Comment by ghost** [comment]
Hello @doomedraven 
I have tested a fresh stup of Capev2 on Ubuntu 24.04 and 22.04
The same issue with internet.
I will try to fix the issue if I had the time.
The actual code here does not really solve the issue:
https://github.com/kevoreilly/CAPEv2/blob/01cb2c16c88b7c6a5787011b4794f61db186a7c7/utils/rooter.py#L418

**Comment by ClaudioWayne** [comment]
Hi
libvirt on ubuntu 24.04 comes with a new network.conf (/etc/libvirt/network.conf)
At least it does not exist on my old server with ubuntu 22.04
```
...
#   If firewall_backend isn't configured, libvirt will choose the
#   first available backend from the following list:
#
#     [nftables, iptables]
...
```
So I guess that libvirt uses nftable-rules under ubuntu 24.04 by default.
So adding `firewall_backend = "iptables"` to /etc/libvirt/network.conf makes dirty-line work again.
Maybe someone can check my theory and give feedback.

my routing.conf:
```
[routing]

enable_pcap = no

route = internet

internet = enp10s0

nat = yes

no_local_routing = no

rt_table = main
....
```

OS: Ubuntu 24.04 Desktop
No netplan configured
Network is managed by default via Networkmanger
systemd-networkd inactive (masked)

**Comment by doomedraven** [comment]
i can confirm, it works, thank you, tested without netplan

**Comment by doomedraven** [comment]
* quick fix:
* `sudo sed -i 's/#firewall_backend = "nftables"/firewall_backend = "iptables"/g' /etc/libvirt/network.conf`
* `sudo systemctl restart libvirtd cape`

**Comment by doomedraven** [comment]
that is fixed with @ClaudioWayne finding
